Author,Date,Region,Sentence,translation
Brunetto Latini,1260-61,fior.,"quella guerra ben fatta l' opera perché etc. Et dall' altra parte Aiaces era uno cavaliere franco e prode all' arme, di gran guisa, ma non era pieno di grande senno","[ERROR]: Failed to connect to Ollama. Please check that Ollama is downloaded, running and accessible. https://ollama.com/download"
Bono Giamboni,1292,fior.,"crudele, e di tutte le colpe pigli vendetta, come dice la legge, ed a neuno cavaliere perdoni che pecchi.","[ERROR]: Failed to connect to Ollama. Please check that Ollama is downloaded, running and accessible. https://ollama.com/download"
Valerio Massimo (red. V1,1336,fior.,"Non d' altra forza d' animo fue ornato Ponzio Aufidiano, romano cavaliere.","[ERROR]: Failed to connect to Ollama. Please check that Ollama is downloaded, running and accessible. https://ollama.com/download"
Lucano volg. (ed. Marinoni),1330/40,prat.,"Se questo piace a tutti e se 'l tempo hae bisogno d'avere Pompeio per cavaliere e non per compagno, non riterrò più i fati.","[ERROR]: Failed to connect to Ollama. Please check that Ollama is downloaded, running and accessible. https://ollama.com/download"
Brunetto Latini,1260-61,fior.,"Officio di questa arte pare che sia dicere appostatamente per fare credere, fine è far credere per lo dire.","[ERROR]: Failed to connect to Ollama. Please check that Ollama is downloaded, running and accessible. https://ollama.com/download"
Simintendi,1333,tosc.,Ecco e larghi ventipiovoli caggiono delle risolute nebbie; e potresti credere che tutto il cielo cadesse nel mare,"[ERROR]: Failed to connect to Ollama. Please check that Ollama is downloaded, running and accessible. https://ollama.com/download"
Agostino da Scarperia (?),1390,tosc.,"Però che or chi spererebbe quello che eziandio questi che non vogliono ancora credere in Cristo, già veggiono con noi, e perché nol possono negare, stridono colli denti.","[ERROR]: Failed to connect to Ollama. Please check that Ollama is downloaded, running and accessible. https://ollama.com/download"
Bono Giamboni,1292,fior.,I vendimenti de' morti et le presure de' vivi fece la frode d'uno feroce re.,"[ERROR]: Failed to connect to Ollama. Please check that Ollama is downloaded, running and accessible. https://ollama.com/download"
Bart. da San Concordio,1313,tosc.,"Acciocché quegli, il quale ora per le sue gran reità è feroce e onorevole, egli d'ogni male afflitto e tormentato della impietà verso il mio padre.","[ERROR]: Failed to connect to Ollama. Please check that Ollama is downloaded, running and accessible. https://ollama.com/download"
Brunetto Latini,1260-61,fior.,Gli uomini spessamente a stare fermi nella bugia incontra la verità.,"[ERROR]: Failed to connect to Ollama. Please check that Ollama is downloaded, running and accessible. https://ollama.com/download"
Filippo da Santa Croce,1323,tosc.,"Marco Cornelio ch'era de' dieci compagni, studiosamente  si riservò di parlare all'ultimo.","[ERROR]: Failed to connect to Ollama. Please check that Ollama is downloaded, running and accessible. https://ollama.com/download"
Cavalca,1330,tosc.,cose ch'io sapeva che erano fatte in Italia.,"[ERROR]: Failed to connect to Ollama. Please check that Ollama is downloaded, running and accessible. https://ollama.com/download"
Valerio Massimo (red. V1,1336,fior.,Corbio nipote d' Ortensio menò sua vita più bassa e più viziosa,"[ERROR]: Failed to connect to Ollama. Please check that Ollama is downloaded, running and accessible. https://ollama.com/download"
Brunetto Latini,1260-61,fior.,"Altressì uno amante chiamando merzé alla sua donna dice parole e ragioni molte, et ella si difende in suo dire.","[ERROR]: Failed to connect to Ollama. Please check that Ollama is downloaded, running and accessible. https://ollama.com/download"
Arte Am. Ovid. (B),1310/13,fior.,"Io mi ricordo (ch. 347) che essendo adirato scapigliai la mia donna. Ohi, quanti dì questa ira mi tolse!","[ERROR]: Failed to connect to Ollama. Please check that Ollama is downloaded, running and accessible. https://ollama.com/download"
Rim. Am. Ovid. (B),1310/13,fior.,colui del quale tu tti solevi dolere ch' era amante della tua donna;,"[ERROR]: Failed to connect to Ollama. Please check that Ollama is downloaded, running and accessible. https://ollama.com/download"
Fatti de' Romani (H+R),1313,fior.,"Ma no sapeano già le nomora di coloro dela congiurazione, ché la donna no nominava già li nomi.","[ERROR]: Failed to connect to Ollama. Please check that Ollama is downloaded, running and accessible. https://ollama.com/download"
Ceffi,1325,fior.,"Creti?  Certo quand'elli si mosse, elli ti dixe: ""O fedele mia donna, fa' che in mio luogo ti sia racomandato il nostro hoste troiano"".","[ERROR]: Failed to connect to Ollama. Please check that Ollama is downloaded, running and accessible. https://ollama.com/download"
Valerio Massimo (red. V1,1336,fior.,"A Milano fue ripressa la malvagità d' una donna in simile bugìa, nel tempo medesimo di questo signore della republica, in questo modo: ","[ERROR]: Failed to connect to Ollama. Please check that Ollama is downloaded, running and accessible. https://ollama.com/download"
Filippo da Santa Croce,1323,tosc.,"E lamentavansi dell'iniquità d'Appio, e ripiagnevano la malavventurata beltà della pulcella e la necessità del padre.","[ERROR]: Failed to connect to Ollama. Please check that Ollama is downloaded, running and accessible. https://ollama.com/download"
Brunetto Latini,1294,fior.,"Nella quale battaglia, certo io ebbi sempre ardire di ragionare di pace e sempre mi dolfi che non solamente la pace era schifata,","[ERROR]: Failed to connect to Ollama. Please check that Ollama is downloaded, running and accessible. https://ollama.com/download"
Bart. da San Concordio,1313,tosc.,"la seconda suole talora per la grande provedenzia fare timoroso, e la prima per l'ardire rendere altrui matto.","La seconda è spesso temuta per la grande provvidenza di far paura, mentre la prima è per il coraggio che fa folli gli altri."
Valerio Massimo (red. V1,1336,fior.,Andò nel campo de' Cartaginesi e tutta la legione trasse seco.,Andò nel campo dei Cartaginesi e portò con sé l'intera legione.
Zanobi da Strada,1361,tosc.,"Non lo volle cognoscere per nimico. Qesta è quella, la quale diede ardire al profeta Natan a riprendere con grande autoritade quello re, il quale avea peccato.","Non voleva riconoscerlo come nemico. Questa è la stessa persona che diede coraggio al profeta Natan per riprendere con grande autorità quel re, il quale aveva peccato."
Frontino volg.,1381,bologn.,"l'armi et insieme con loro passaseno tra li nimici, perçò se alcuno non avesse ardire de questo et sì avevano questo animo.","Armi e insieme con loro si passano tra i nemici, quindi se qualcuno non ha il coraggio di farlo e lo ha, allora lo hanno."
Giovanni da San Miniato,1415,tosc.,Unde ragionevolemente Iob è interpretato dolente;,"Io sono un uomo che soffre, ma non ho mai detto di essere un uomo che soffre."
Filippo da Santa Croce,1323,tosc.,"quello che sopra tutti gli altri perdonasse a' cittadini, e a cui più sicuramente possiate credere; poi ch'egli fu vostro comandatore.","Chi sopra tutti gli altri perdonava ai cittadini, e a chi più sicuramente potevate credere; poi che era il vostro comandante."
Zanobi da Strada,1361,tosc.,"in vano si domanda chi questo Libro scrivesse, con ciò sia cosa che fedelmente si debba credere che l'Auttore di quello fusse lo Spirito santo.","In vano si chiede chi abbia scritto questo libro, con ciò sia cosa che fedelmente si debba credere che l'autore di quello fosse lo Spirito Santo."
Agostino da Scarperia (?),1390,tosc.,"se non fosse usatissima, ciò parrebbe certo molto più incredibile: certo più agevolmente si può credere quello, posto che l'umano spirito al divino, ed il mutabile allo incommutabile","Se non fosse così comune, ciò sarebbe certamente molto più incredibile; certo è più facile credere quello, posto che lo spirito umano al divino e il mutabile all'incommutabile."
Brunetto Latini,1260-61,fior.,che prendessero la paga dal camarlingo per loro dispensa et immantenente andassero alla presenzia di messer lo papa per contradiare il passamento de' cavalieri che veniano di Cecilia in Toscana,che avrebbero ricevuto la retribuzione dal camarlingo per la loro dispensa e poi sarebbero andati alla presenza del papa per contraddire il passaggio dei cavalieri che venivano da Cecilia in Toscana
Bonsignori,1375-77,umbr.-tosc.,"Teseo reguardò Achelao fortemente meravigliandose e disse così: ""O messer Achelao, io vi prego che voi me diciate in che modo voi perdeste","Teseo guardò Achelao con grande meraviglia e disse: ""Oh signor Achelao, mi prego di raccontarmi come avete perso""."
Giovanni da San Miniato,1415,tosc.,"Io spero in messer Iesù di mandare tosto a voi Timoteo, acciocché io sia d'animo buono","Spero che il Signore Gesù ti invii presto, così posso essere in pace."
Brunetto Latini,1260-61,fior.,sanza fallo lo porco salvatico avanza l' uomo d' udire e 'l lupo cerviere del vedere,Il maiale selvaggio si avvicina all'uomo per ascoltare e il lupo cerviere per vedere.
Bono Giamboni,1292,fior.,uno luogo si mandano lancioni;  la quale cosa i cavalieri l' appellano capo di porco,Uno luogo dove vanno le lance; che cosa i cavalieri chiamano il capo del maiale.
Arte Am. Ovid. (B),1310/13,fior.,tenda le reti a li cerbi e sa bene in quali valle dimori il furioso porco cinghiare.,'Tenda le reti a li cerbi e sa bene in quali valle dimori il furioso porco cinghiare.'
Rim. Am. Ovid. (B),1310/13,fior.,"Ora spaventerai li disidirosi cervi con varie e diverse paure, o lo porco cenghiare caggia in terra passato collo spiedo.","Ora spaventerai i cervi disidirosi con varie e diverse paure, o il maiale cenghiare caggia in terra passato collo spiedo."
Brunetto Latini,1260-61,fior.,"tratta la natura delle cose incorporali le quali non conversano intra lle corpora, sì come Dio e le divine cose.","Le cose incorporee che non si trovano nei corpi, come Dio e le cose divine."
Bono Giamboni,1292,fior.,"Dio, per la quale si dispensano et iudicano tutte le cose.","Dio, che giudica e decide tutto."
Bonsignori,1375-77,umbr.-tosc.,"Unde gli poeti, parlando de lloro, dicono le virtute loro e dicono fabolosamente gli loro difetti, quando alcuna passava l'ordine a lloro deputato","I poeti, parlando di se stessi, dicono le loro virtù e dicono fabolosamente i loro difetti, quando qualcuno passa l'ordine a loro assegnato."
Giovanni dalle Celle (?),1396,tosc.,"e quella cosa, la quale è diricta et onesta, e con virtute, quella sola penso essere lo bene.","Quella cosa, che è diretta e onesta, e con virtù, quella sola penso essere il bene."
Fatti de' Romani (H+R),1313,fior.,"Quando li serpenti invellenava di giorno alcuno Romano, allora iera la maraviglia a vedere come li Psille si combattevano al veleno, ché elli imolavano tutto inazzi della loro salive","Quando i serpenti avvolgevano alcuni Romani di giorno, allora era meraviglia vedere come si combattevano contro il veleno, perché imolavano tutto inizialmente della loro saliva."
Chiose a Rim. Am. (B),1310-,fior.,"Dice il poeta: oh, che bella cosa è vedere apertamente con gli occhi quando tu glel fai diretro o in culo o in altro","Il poeta dice: Oh, quanto bello è vedere apertamente con gli occhi quando lo dici direttamente o dietro o in altro."
Cavalca,1330,tosc.,"ma pur questo fu colpa tua, però che volesti cercare di vedere con gli occhi corporali la cosa invisibile.","Ma anche se è stata colpa tua, volevi provare a vedere con gli occhi fisici la cosa invisibile."
Brunetto Latini,1260-61,fior.,"Vero è, ma non tine rispondo in questo tempo, perciò che ttu se' mio servo, o perciò ch' è tempo feriato, o perciò ch' io non debbo risponderti","La verità è, ma non ti rispondo in questo momento, quindi che tu sia il mio servitore, o perché è tempo di festa, o perché io non devo rispondere a te."
Fatti de' Romani (H+R),1313,fior.,sì convene che lli desse grande avere perché · lasciasse andare via.,"Sì, è chiaro che gli piace molto perché ha lasciato andare via."
Filippo da Santa Croce,1323,tosc.,"notabile esemplo a ciascuno che si guardasse di fare e di pensar tradigione, il servo, il quale gli avea accusati, fu francato, e fugli donata grande quantità di moneta","Un esempio notevole per chiunque si prendesse cura di fare e pensare tradizionale, il servo, che gli aveva accusato, fu liberato e gli furono date grandi quantità di moneta."
Valerio Massimo (red. Va),1336,tosc.,che sarebbe a llui cosa sconcia se ll'avesse commesso sì che lla colpa del servo e 'l gastigamento di Platone avesse meritato egualmente.,"Che sarebbe a lui cosa sconcia se l'avesse commesso, sì che la colpa del servo e il gastigamento di Platone avrebbero meritato egualmente."
Valerio Massimo (red. V1,1336,fior.,"mostroe massimamente le forze sue, dando lui re a questa cittade ne la quale nacque servo; al quale avvenne lunghissimamente lo imperio tenere","Mostra le sue forze in modo massiccio, concedendo il regno a questa città in cui è nato servo; a lui è stato concesso di tenere l'impero per un lungo periodo di tempo."
Brunetto Latini,1260-61,fior.,l' anima muta la sua forza per la propietade di quello corpo a cui ella si congiunge.,L'anima si unisce alla sua forza al corpo a cui è legata.
Cavalca,1308,tosc.,"sono due già non in una carne, ma in uno spirito, cioè Iddio, e l' anima. Onde in altro luogo dice S. Paolo: Chi s' accosta a Dio è uno spirito","Sono due già non in una carne, ma in uno spirito, cioè Dio, e l'anima. Onde in altro luogo dice S. Paolo: Chi s' accosta a Dio è uno spirito."
Fatti de' Romani (H+R),1313,fior.,"per tanto che Lucano il disse, il vi racontiamo. Ivi, quando l'anima di Pompeo ebe sentito la chiarità di lasusso, ella sì cognobe prima in  grande","Quindi Lucano disse che ti raccontiamo. Lì, quando l'anima di Pompeo ebbe sentito la chiarezza del lascito, essa si riconobbe prima in grande."
Bono Giamboni,1292,fior.,"Sicchè dolore è a udire, quando l' usare l' arme e la fatica ricusano, con grandissimo disonore come pecore essere","Sicuramente il dolore è di sentire, quando l'uso dell'arma e della fatica si rifiutano, con grande disonore come pecore essere"
Bono Giamboni,1292,fior.,et nonn ebbe in fastido Cristo cotali parole d'udire.,Et non ebbe in fastidio Cristo udire tali parole.
Prima catilinaria volg. (red. A),1294,fior.,"la moltitudine de' quali tu ài potuto vedere e riguardare lo studio e poco dinanzi udire le voci, e lle cui mani e lance apena posso ritenere.","La moltitudine di quelli che hai potuto vedere e guardare lo studio e poco prima udire le voci, e le cui mani e lance appena riesco a trattenere."
T. Alderotti (?),1295,fior.,"udire di belle novelle et odorare di belli fiori, come et quando et quanto si conviene","Udire di belle novelle e odorare di belli fiori, come e quando e quanto è appropriato."
Filippo da Santa Croce,1323,tosc.,"Il re entrò in uno giardino dietro al suo albergo, quasi come s'egli andasse pensando alla risposta.","Il re entrò in un giardino dietro l'albergo, quasi come se stesse pensando alla risposta."
Ceffi,1325,fior.,"Ma io disioso colà dove io non posso col corpo andare, con la mente vi volo","Ma io desideroso di lì dove io non posso andare con il corpo, con la mente vi vado"
Guido da Pisa,1337,tosc.,Ed ecco di subito tutta questa turba degli uccelli si levò a volo dietro all'aquila,"Ecco, in fretta, tutto questo branco di uccelli si è alzato in volo dietro all'aquila."
Grazia di Meo,1343,tosc.,Vede anche le ragioni del volo degli uccielli e di tutte le cose sa rendere vero giudicio.,Vedi anche le ragioni del volo degli uccelli e di tutte le cose sa rendere vero giudizio.
Zanobi da Strada,1361,tosc.,Or ecco quanto per la sua superbia questo uccello volava in alto.,Questo uccello volava in alto a causa della sua superbia.
Bonsignori,1375-77,umbr.-tosc.,"Gorgone, e ho questa proprietà che io volo per l'aire sì come uno ucello"".","Gorgone, e ho questa proprietà che io volo per l'aria così come un uccello."
Bono Giamboni,1292,fior.,"quando nella matricola si scrivono giurano per Dio, e per Cristo, e per lo Spirito Santo","Quando nella matricola si scrive il giuramento di Dio, di Cristo e dello Spirito Santo."
Bono Giamboni,1292,fior.,"per necessitade i' ridico ke, secondo il comandamento tuo, padre santo Agostino, le battaglie già state nel mondo [..]","Per necessità, mi ritrovo a ridere, secondo il tuo comando, santo Agostino, le battaglie che sono già state nel mondo [..]"
Brunetto Latini,1294,fior.,"molto di maggiore memoria saranno faccendole al re, perciò che nella nostra cittade sempre fue santo e glorioso il nome reale, e sse furono compagni fue il loro nome santissimo;","Molti di maggiore memoria saranno facendole al re, perciò che nella nostra città sempre fu santo e glorioso il nome reale, e se furono compagni fu il loro nome santissimo;"
Cavalca,1308,tosc.,"Non voglio, che insuperbischi per lo santo proposito, e voto della verginità vedendo le sue laudi","Non voglio, che superi per il santo proposito, e voto della verginità vedendo le sue laudi."
Fatti de' Romani (H+R),1313,fior.,"Santo Agostino fece u· libro ch'avea nome ""Agostino Della Città di Dio"".","Santo Agostino scrisse un libro che si intitolava ""Agostino della città di Dio""."
Cavalca,1330,tosc.,Gregorio. Non udii mai che egli avesse maestro; ma il dono dello Spirito Santo non si può stringere a legge.,Gregorio. Non ho mai sentito dire che avesse un maestro; ma il dono dello Spirito Santo non può essere limitato da una legge.
Brunetto Latini,1260-61,fior.,Verbigrazia: Mercatanti fiorentini passavano in nave per andare oltramare.,I mercanti di Firenze navigavano in barca per andare oltremare.
Bono Giamboni,1292,fior.,"Quando averai nel cavaliere i detti segni veduti non andare a grandezza caendo, perchè nelle battaglie sono più utili i forti che i grandi.","Quando avrai il cavaliere con i segni visti, non andare a grandezza cadendo, perché nelle battaglie sono più utili i forti che i grandi."
Bono Giamboni,1292,fior.,"e, cosa che anche è più grave, cioè essere preso, o vero fuggire, e suo Comune lasciare vincere.","E, cosa ancora peggio, cioè essere presi, o vero fuggire, e il proprio comune abbandonare."
Filippo da Santa Croce,1323,tosc.,"Sappiate veramente, che se noi non ci fossimo sì affrettati del fuggire, noi saremmo tutti morti.","Sapete davvero, che se noi non ci fosseamo ritirati in fretta, noi saremmo tutti morti."
Deca quarta,1346,fior.,"Tarco cretense che in aiuto era alli nimici avrebbe potuto fuggire, ma la vergogna d'abbandonare li nobilissimi cavalieri della gente achea poco avanti da lui","Tarco cretense che in aiuto era alli nimici avrebbe potuto fuggire, ma la vergogna d'abbandonare li nobilissimi cavalieri della gente achea poco avanti da lui."
Brunetto Latini,1260-61,fior.,"e l' acconciamento a fare grandissime cose, cioè a ttenere pace et amare Idio e 'l proximo, a ffare cittadi, castella e magioni","E il capelli per fare grandi cose, cioè per tenere la pace e l'amore di Dio e del prossimo, per fare città, castelli e case."
Giovanni da San Miniato,1415,tosc.,colui che ancora non sa amare il prossimo come sé medesimo già cominci a temere i giudicii di Dio. ,"Chi non sa ancora amare il prossimo come se stesso, inizia a temere i giudizi di Dio."
Arte Am. Ovid. (B),1310/13,fior.,"L'ucello, poi che hae impaniate le ali, non fugge salvamente, né llo porco salvatico esce bene delle reti ove cade.","L'uccello, dopo aver spiegato le sue ali, non riesce a fuggire in salvo, né il maiale selvaggio esce bene dalle reti in cui si imbatte."
Cavalca,1308,tosc.,"Io gli apersi, e quelli fuggitte. E che bisogno è, che lo cuore tuo stia chiuso al tuo sposo Cristo?","Io gli apersi, e quelli fuggitte. E che bisogno è, che lo cuore tuo stia chiuso al tuo sposo Cristo?"
Prima catilinaria volg. (red. A),1294,fior.,"E dunque, da che queste cose son così, Catellina, e tu non puoi buonamente qui dimorare, dubiti tu d'andartene in alcuna terra ed usare questa vita fuggendo per li diserti","E quindi, da che queste cose sono così, Catellina, e tu non puoi buonamente qui rimanere, dubiti tu di andartene in alcuna terra ed usare questa vita fuggendo per i deserti."
Chiose a Valerio Massimo (D - L. I-V),1346,tosc.,"Questi due, volendo contra la voglia del senato dimorare ne l'ufficio del tribunato, furono morti da la plebe, incitandola i padri coscritti.","Questi due, volendo contrari alla voglia del senato dimorare nell'ufficio del tribunato, furono uccisi dalla plebe, incitandola i padri coscritti."
Bono Giamboni,1292,fior.,"i giovani, a cui il difendimento delle provincie, e la ventura di tutta la battaglia si commette","I giovani, che sono stati incaricati di proteggere le province e affrontare l'intera battaglia."
Bono Giamboni,1292,fior.,"da' monti de' Romani si feciero nuovi nemici; contra i quali è conbactuto cum diversa ventura: perké nela primaia battaglia, essendo consolo Valerio, MMMD ne moriro de' Romani;","Da' monti de' Romani si feciero nuovi nemici; contro i quali è conbattuto cum diversa ventura: perché nela primaia battaglia, essendo consolo Valerio, MMMD ne moriro de' Romani."
Fatti de' Romani (H+R),1313,fior.,"noi iscaciati e dipartiti per debito dela cittade, e tutti iscaciati da fama e da ventura buona.",Noi siamo partiti dalla città a causa di un debito e tutti noi siamo stati lasciati dalla fama e dalla fortuna.
Simintendi,1333,tosc.,pregaste gli dei per me; e' vostri preghieri valsono: e se voi domandate chi ebbe ventura di questa battaglia; io non fui vinto da colui.,Prega gli dei per me; e' le vostre preghiere valgono: e se voi domandate chi ebbe fortuna di questa battaglia; io non fui sconfitto da lui.
Valerio Massimo (red. V1,1336,fior.,"una villa chiamata Vitermina, con ciò fosse cosa che piusori principi di scherani corressero per ventura a quel tempo a vederlo, Scipione, stimando che venissero per isforzarlo, allogò ne la casa","Una villa chiamata Vitermina, con ciò fosse cosa che i principi di scherani corressero per ventura a quel tempo a vederlo, Scipione, stimando che venissero per isforzarlo, allogò ne la casa."
Brunetto Latini,1260-61,fior.,contra lui e contra le sue sorelle  e contra il reame e contra l' alto pregio della sua ingenerazione e della sua familia,"Contro di lui e contro le sue sorelle, e contro il regno e contro l'alto onore della sua discendenza e della sua famiglia."
Fatti de' Romani (H+R),1313,fior.,"Allora che il navilio si fue impinto e messo in alto mare per andare diritto per mezo questo trapasso periglioso, l'aira divenne nuvolosa e pioveginosa","Allora il navilio si mise in alto mare per andare direttamente attraverso questo passaggio pericoloso, l'aria divenne nuvolosa e piovigginosa."
Filippo da Santa Croce,1323,tosc.,"ne salìo in su l'argine del fosso, e in su lo steccato, se da alto si potessero difendere, o per alcuna maniera passare oltre e scampare.","Salì sulla riva del fossato e sul palo, in modo che potesse difendersi da lassù o trovare un modo per passare oltre e fuggire."
Alberto della Piagentina,1330/32,fior.,"Ma l' occhio della intelligenza è più alto. Perciò che, passata la grandezza della universitade, quella medesima semplice forma vede nella sottil vista","Ma l'occhio dell'intelligenza è più alto. Pertanto, dopo aver superato la grandezza della università, la stessa semplice forma vede nella sottile vista."
Brunetto Latini,1260-61,fior.,"Et se l' occhio è nobile membro del corpo dell' uomo, dunque la salutazione è nobile parte della pistola, c' altressì allumina tutta la lettera come l' occhio allumina l' uomo.","Se l'occhio è il membro più nobile del corpo dell'uomo, allora la salutazione è la parte più nobile della pistola, che illumina tutta la lettera come l'occhio illumina l'uomo."
Bono Giamboni,1292,fior.,"Tarentini, i quali erano nati di quegli di Lacedemonia et facta da lloro nobile cittade de' Greci.","Tarentini, che erano nati da quelli di Sparta e fatti dalla loro nobile città greca."
Fatti de' Romani (H+R),1313,fior.,"Ulecois, ebe un uomo rico e nobile: Orgentore fue chiamato per nome.",Ulecois aveva un uomo ricco e nobile: Orgentore era il suo nome.
Valerio Massimo (red. Va),1336,tosc.,"però che, sse nobile cosa e alta è abatte il nimico, ampoi nonn è meno laudabile sapere avere misiricordia","Tuttavia, se una cosa nobile e alta è abbassare il nemico, non è meno lodevole conoscere avere misericordia."
Bono Giamboni,1292,fior.,"Alexandri, ciò è il genero e 'l figliuolo, da Phausonia, gentile iovane di Macedonia, stando in uno luogo strecto sanza guardia, fue morto.","Alexandri, questo è il genero e il figlio, da Phausonia, giovane nobile di Macedonia, si trovava in un luogo stretto senza guardia e fu ucciso."
Grazia di Meo,1343,tosc.,"Alchuno è riccho e gentile, ma lamentasi che vorebbe avere altra moglie che quella ch'egli à.","Alcuni sono ricchi e gentili, ma si lamentano di voler avere un'altra moglie che quella che hanno."
Zanobi da Strada,1361,tosc.,"Pietro, essendogli mostrato in figura il populo Gentile, sì gli fu detto: ammazza, e mangia","Pietro, dopo averlo visto in figura il popolo gentile, gli disse: uccidi e mangia."
Declamazioni di Seneca,1392,tosc.,"pregollo che lo liberasse di quella obbligazione, in che egli l' aveva lasciato ubbligato. El gentile uomo assentì, e liberollo, e fecene carta.","Il gentile uomo accettò e lo rilasciò, e gli diede una carta."
